date,rating,review,reviewer,title,ymd
21-10-2022,5,My family & I recently stayed in ITC Maratha for 3 nights this month. We had booked an Executive suite but were upgraded to a Deluxe Suite as the key cards/lights weren't working during check in.  The room was spotlessly clean but the general upkeep of the rooms could be better. The hotel could do well with a kids' zone even a small one. ,Indrani D,3 nights family stay,221021
20-10-2022,5,Excellent location right near the airport. Staff is super accommodating to all kind of needs. Special shout out to Atharv from the Peshwa Cafe very courteous and empathetic to guests requirements. Comfortable stay with well appointed rooms. ,278vinays,Seamless Experience @ ITC Maratha,221020
19-10-2022,5,Excellent property. Beautiful rooms. Great decor. Very friendly staff esp mr. Lalit helped me at lot and people at reception were very helpful. Even they allowed me little late checkout. Overall great experience. Sunday lunch brunch was excellent.,ajaybudhwar,Excellent,221019
13-10-2022,5,Home away from home!,Shweta A,Home away from home!,221013
09-10-2022,4,Kudos to the front desk at ITC Maratha Sheraton Mumbai.,Journey520757,My Stay at ITC Maratha,221009
06-10-2022,5,We are very impressed with our stay. Staff at this property left no stone unturned to make us feel welcome. Thanks. Would particularly compliment Patil Chef and Gous at swimming pool . Also the team that maintains garden so well. Keep it up - will surely visit again.,sandeepFICOAce,Excellent stay,221006
06-10-2022,5,Stayed at ITC Maratha for a couple of days with my family for a leisure vacation at Mumbai. Had requested for adjacent rooms for my kids that was taken care of. On checkin I was upgraded to the pool view rooms. The service and the food were exceptionally good. The  food was deliciously tasty and special thanks to the whole culinary team at the Peshwa Pavilion.  Chef Sridhar Patra and Chef Pravin Patil were great hosts at the breakfast table we enjoyed some cooking tips exchange and they also took special care of my young son who loves food.  Thank you so much for making our stay so wonderful. The dinner buffet spread was also very lavish and the decor of Peshwa Pavilion is just too nice. Overall very nice stay and my family thoroughly enjoyed the experience. Just wanting to visit Mumbai again and stay there,yogender2019,Awesome stay at the ITC Maratha,221006
04-10-2022,5,Alwayz pleased n excited to stay at ITC because of its grandeur n exquisite architecture..the interior design the garden gym restaurants are all so well intricate.  I was greeted n guided at the helpdesk and the morning complimentary breakfast are well placed n planned only same every day..The gym is a very nice place to go as u have friendly Trainers like Ganesh Nitin.  The pool is slwayz busy as guests come in now n then.  I loved Dum phukt and the meals be it a Dum phukt biryani or kebabs with bread was a delicacy.,Arlu0411,4 day B'day Bash,221004
28-09-2022,5,Very welcoming and friendly staff. Our masseurs Leimi and Bimila were very professional and we thoroughly enjoyed our spa experience. We travel a lot and good relaxed spa experience always helps. One of the best experiences we have hd and would highly recommend Kaya Kalp at ITC Maratha. Do ask for Leimi or Bimila as they were wonderful,Rohitkt,Kaya Kalp Spa!,220928
28-09-2022,5,Great experience with helpful staff. Met Ganesh at the gym who was very concerned about my routine and also helpful with tips on exercise recovery and nutrition. Overall a wonderful experience and would highly recommend.,KrishanDhall,Nice facilities and great staff,220928
26-09-2022,5,I stayed in itc maratha for one night rooms are very nice and its very Clean. Awesome lobby and service is excellent. Its very near to international Airport. Staff is always ready to give personalised service.,Ajin07,Best Service,220926
25-09-2022,5,We had booked ITC Maratha for a business conference and are extremely happy with the food arrangements. Would like to especially thank Chef Nikhil Merchant and Chef Tushar Bhattacharya. They designed a menu that took care of jain veg and non-veg participants. Moreover the live counter added glitter to gold. After the conference we got a lot of positive feedback about the food. Thanks!,Piyush B,Excellent food arrangements for a business conference,220925
23-09-2022,4,I stayed with them on 9th Sep.,Kranthi_Vizag,Good luxury hotel with scope for improvement in service,220923
12-09-2022,5,Lovely property brilliant staff!,udy11,Lovely property brilliant staff!,220912
11-09-2022,2,This is my first trip to india with no expectation at all. The check-in was horrendously bad i was told to wait for 2 hours so i went to a good Peshwari restaurant and had a great lunch there.,ferrymul,Rundown luxury hotel near airport,220911
01-09-2022,5,ITC Maratha is always a very special place for myself staying with them for 2 decades love the warmth and hospitality.,bharatv121,Wonderful stay great food,220901
31-08-2022,3,Stayed at ITC for a day. ,SMohan76,Visit in august.,220831
24-08-2022,1,Poor Service  Poor Hospitality,JaydeepRajhans,Poor Service  Poor Hospitality,220824
21-08-2022,2,I live in Chicago and here for business thinking this is near the airport so its easy to commute. ,Akshay00000009999,Absolutely terrible due to impossible access to Taxi Ubers. If you are a foreigner be ready to be exploited by taxis,220821
20-08-2022,5,Stayed two nights at the hotel.  Great room and general decor around the hotel.  Very efficient staff.  At the reception Ayesha Jasleen and Urvsashi were quick professional and friendly both at time of check in and check out; ensured that we got the best room available and during the stay constantly inquired with us that we were comfortable.  The Pavilion restaurant is outstanding.  The breakfast buffet spread is one of the best. The staff here have been highly trained; mention must be made of the senior people here: Derrick and Hitesh and the chefs Pravin Vinayak and Sreedhar.  The buffet lunch is not to be missed.  In particular the Rogan Josh the mutton biryani and the Saag ghost are out of this world. Highly highly recommended. While one ejoys the decilacies always available is the superb service by the staff there; cannot list all but some whose names I recollect are Hariprasad Amin and Riva.,mathurpradeep017,Superb lunch buffet,220820
16-08-2022,5,Fabulous stay and fabulous hotel. We walked down 8-9 mins to reach the hotel. Its very convient. Even t2 departure is 4 mins drive,Ankit K,Great place for transit,220816
10-08-2022,5,Peshwa pavilion managed by Chef Pravin. The personal attention to every patron was excellent with emphasis on individual tastes & what not.,PravinA101,Wow food,220810
06-08-2022,5,Akshay Kamble and Mitesh is very co operative and excellent service in my stay.,985maheshb,Memorable stay in ITC Maratha,220806
05-08-2022,5,This was my one of my many repeat visit to this hotel.,nisheethkumart,Positive review & feedback on my Stay at ITC Maratha Mumbai durin end July'22,220805
30-07-2022,5,We would like to express our sincere thanks and Gratitude to Mr Chetan who demonstrated excellent hospitality & service during our dining at Peshwa Pavilion ITC MARATHA Andheri. He was on his toes and always welcomed us with smiling gesture. Recommend for his growth,maninders873,EXCELLENT HOSPITALITY & SERVICE,220730
27-07-2022,1,The stay in this hotel is horrible. Was here for 3 nights hygiene completely neglected. Horrible service had to change my room the first time because the rooms werent cleaned. The second room I got was smelling of sweat. Reminded me of those black and yellow taxis. Will never stay here again and will never recommend this hotel.,Coastal21114411143,HORRIBLE HOTEL NEVER STAY HERE. DO OTHERS A BLESSING BY NEVER Recommending￼ THIS HOTEL. Nothing about this hotel is Good,220727
16-07-2022,5,The team is very courteous humble and approachable for any help - esp. Urvashi Dimple raunak and the front office staff. Top notch hospitality excellent food and good room service!!,Deepak-mupparala,Excellent hospitality!!,220716
11-07-2022,3,Basically it was a good stay in terms of hospitality but i would like to give a review on food that for lunch and dinner they were serving Indian breads which was cold instead of hot and fresh breads and when we asked them for hot ones they gave us the same bread. ,Sanmitrajadiyar,Experience review,220711
10-07-2022,5,Hotel with a luxurious stay in the heart of business city. Have had food with family at Peshwari umpteen times. The Chinese food at Pan Asia is to die for. To savour a South Indian delect one must try out the thali at Dakshin. The Spa decor and ambience at Kaya kalp gives a luxury feel. Overall an impeccable and relaxing stay. Staff is very courteous. ,captanupamc,Luxury Stay worth the pricing !! ,220710
09-07-2022,5,It has been an amazing and cozy stay the staff has been really helpful and welcoming all the time..,BRoshni95,It has been an amazing leisure stay!,220709
04-07-2022,5,I stayed at this hotel for a couple of nights in July 2022. At first I was a little apprehensive about the service I would receive. The great people at ITC Maratha shot this out of the park. The hotel is a bit dated but the people are what makes this place feel like a home away from home.,Savgoa,ITC Maratha! Great people that run this hotel,220704
01-07-2022,5,I stayed in this hotel for 3 days in June. The experience was fantastic. Very polite well mannered staff. Namely Maxime (Concierge) and Lalit and Ketan (bell desk). They greeted me every time with a smile and a namaste. Maxime helped me with everything- from calling in favors to help me shop for my family abroad to getting me in touch with a good courier company that came to the hotel to pick up my parcel. He was quick to respond to all my questions and that helped tremendously. Lalit and Ketan helped me with my bags booking my cabs to go into the city and also helped get me some medicines I needed on the day of my check out. They went of their way to help make my stay comfortable. Will be returning to this hotel for my future stays because of these people that know what real customer service should look like.,316kasturik,Luxury hotel very close to Mumbai international airport,220701
30-06-2022,5,The hotel is very nice and very close to International Airport. We stayed in this hotel for a day because we had an international flight to catch. The food is very good and the staff is amazing. Very smooth check-in and check-out.,advocate_ashishgupta,Good experience,220630
30-06-2022,5,Excellent staff very helful. Urvashi and Muskan from guest relations very cordial and made us feel like home for all the process. The Breakfast is excellent and so is the ambience and the facilities.Love to come back again.,mannarik17,Excellent hospitality,220630
28-06-2022,4,Two years of Covid had taken a toll. Being cooped up inside a 2-bedroom apartment can get trying. So we decided to go for a staycation at ITC Maratha. ,Anindya_Banerjee,Truly luxurious,220628
27-06-2022,5,We had gone on a staycation over the weekend . ,dhruv59,Go for the expectational food and excellent hospitality,220627
26-06-2022,5,Maratha is led by the most humblest person Mr. Aadhaar Sharma. The front desk is an exceptional team special mention to Mr. Kausha Savardekar who went above and beyond to make my stay a memorable one. Maratha is a place that never disappoints. A place that will forever be my second home. Each and every stay will be a memorable and spectacular one. The courtesy and efficiency of each staff is commendable. Until we meet again Maratha. Kudos ️,Fernandes_Abbie,A stay that will be remembered ❤️,220626
20-06-2022,5,I have had amazing and memorable service experience in grand maratha. Urvashi the guest relations has been exemplay courteous service minded and her attention to a guest beyond compare. I wish her glorious service continue to attract more visitors to itc and may she scale in her career.,Aumsairam504,Service and gratefulness,220620
20-06-2022,5,Amazing experience had been here with Family to celebrate my birthday and ITC made sure it was special. ,RandeepG,Amazing experience one cannot miss,220620
18-06-2022,5,Excellent experience with Jasleen kaur and calling experience with harshita. Harshita from reservations had calmly understood my problem and was able to fix the issue.,SatyaR20,Review for Jasleen kaur,220618
18-06-2022,5,I have stayed in multiple properties but this one made an unforgettable impact in its service ambience and staff cooperation. Special thanks to Urvashi from Guest relations team that was epitome of communication and addressing customer queries and concerns. Gorgeous smart lady along with Mr Sushant helped me for early checkin that helped me a lot to deliver my business deliverables efficiently.,gupta_rachit91,Excellent Staff with unmatched amenities 👌,220618
17-06-2022,5,From front desk to Rooms butler service and restaurants everything was perfect.,Indrajit39,An oasis of luxury and efficiency.,220617
17-06-2022,4,I have stayed at this Hotel many times. ,Quest35721429690,A Low in my experiences at ITC Maratha,220617
17-06-2022,1,We checked into ITC Maratha as we had a wedding to attend there. Our room had small cockroches. The headstand of the bed was falling apart and the carpet looked never cleaned. Very disappointing.  We will never visit again. Even the gym was unclean. The mats were dirty. ,Yogini S,Horrible hygiene,220617
16-06-2022,4,The check in process is seamless and staff are co operative.Room looks quite ordinarygetting foul smell have to call the staff for room spray. Food menu is just adequate but as usual seen in ITC hotelsfood quality is very good in the Breakfast and Dinner.,padma2nicky,Room needs upliftment,220616
16-06-2022,5,Truly Indian hospitality. Loved every action from the hotel. Starting from Front Desk to Resturant to Room. Everyone only speak one language. “Whats best for guest is best for ITC”. ,jainsripal,Truly 5 Star Experience,220616
13-06-2022,5,Please to provide this review about the profession service provided at ITC Maratha.,Tapan5523,Quality of service,220613
13-06-2022,5,We thoroughly enjoyed our stay. ITC Maratha is an absolutely magnificent hotel. Staff is very humble and cooperative especially Raunaq a 23 year old sweet fellow from Rajasthan who served us dinner and harihar the guy who came to clean our room late in the night after we accident spilled coffee on the hotel floor oops! ,aastha_s1811,Aastha & Shourya,220613
13-06-2022,1,Where do I begin? ,kindaweirda,Boring Everything,220613
11-06-2022,5,Had a great experience staying At ITC Maratha  The Staff is Humble and Attentive . ,Himal P,Amazing Experience,220611
11-06-2022,5,Beautiful stay quality of service was excellent. Specially Tyson at front desk made our checkin and stay at an ease. In addition Jasleen Kaur from GSE was outstanding to ask for all possible feedbacks. ,ranjanasarkar,Ranjana sarkar,220611
11-06-2022,4,Excellent property with close proximity to the airport. Room 1626 was spacious and had  everything needed. ,mandarkanetkar,Great stay at ITC,220611
10-06-2022,5,ITC Maratha is truly a great please to unwind and relax. The hotel is beautiful with a great lobby and the coffee shop which is looked upon by the floors and beautiful palm trees. ,ayelangar,ITC Maratha- Luxury in its true self!,220610
07-06-2022,5,It was a wonderful time with ITC Maratha. I am platinum of Club ITC and they had give us all the benefit what platinum member is entitle. Mr. Dimple had took express check-in and that was very help as I had travel from way. Door man and bell boy was happy to help us to arrange taxi. ,899dhavalp,Vacation Stay,220607
22-05-2022,5,Staycation At Its Best!,vivek k,Staycation At Its Best!,220522
16-05-2022,5,Had a wonderful stay and the staff was amazing and made us feel like home. ,101saleema,Appreciation,220516
13-05-2022,5,Hospitality and lovely people - that is what ITC Maratha treats you with,rajesh_the_traveller,Hospitality and lovely people - that is what ITC Maratha treats you with,220513
08-05-2022,5,I have been traveling to Bombay on business for many years now. It was in the lockdown period I started frequenting the ITC Maratha and my experience has been fantastic till date they take excellent care of your needs as a guest the staff is very courteous. The duty manager Chandranath is a excellent ambassador of the hotel. It is very conveniently located so suits my needs and the restraurants are outstanding. So overall a must stay premium property of Itc worth staying all ways.,SiddharthJ28,A Second Home,220508
07-05-2022,5,ITC Maratha has always been an amazing experience with a great hospitality. I was celebrating my sister's birthday in April and i would like to thank Maxim for helping me make it the best one for her. Maxim is very helpful and provided with excellent service. Wonderful experience!,MKomal,Excellent hospitality!,220507
06-05-2022,3,I had high expectations as it is an ITC hotel in a place like Mumbai. But starting from check-in which was incredibly slow I was quite disappointed with the overall ambience. I personally would rate ITC Maurya New Delhi where I have often stayed as a decidedly more well put together place with that additional luxe factor.,gargichat,Nothing Extraordinary ,220506
01-05-2022,5,This was our second time at ITC Maratha Mumbai and with every visit we fall more in love with this place! We made an impromptu last minute booking and the staff was very accommodating and super polite. Our special requests were taken into consideration and in spite of being fully booked we were given a late checkout. ,sanjana_kevin,A wonderful stay at ITC,220501
01-05-2022,5,Our Air India flight from US was delayed by a day and a half. The reservations at the hotel were very helpful and accommodated us when we arrived after a long journey in the middle of the night. Thanks to Mr. Mohd. Ali and others.  Restaurant is excellent.  Great service by Gaushiya Khan. Thanks for a memorable stay.,mathurpradeep017,Extremely helpful.,220501
29-04-2022,5,This is a majestic hotel - featuring the grandeur & amenities one would expect of a hotel of this caliber. But what truly sets it apart is the hospitality and courteousness of the staff - starting with the finely attired doormen the Front Desk the Guest Relations team the Concierge Room Service and Housekeeping crew. The politeness that India can be famous for is on full display at this hotel. That aside the rooms are finely appointed and the beds divine. We will definitely be back.,66DM,Excellent stay - incredibly warm & hospitable staff,220429
28-04-2022,5,This is one of the best hotel experience I had in my life. The hotel is super clean luxurious! The staff was super helpful friendly. Maxim was the problem solver guy! Special thanks to Maxim. 5️. He helped me sending a gift to another city through a trusted courier which reached in just a day! Thank you all!,gevb2013,Best customer support great experience clean hotel awesome team,220428
26-04-2022,5,We had a wonderful experience with planning a last minute surprise for the Bride and Groom. Thanks to Jasleen she made it possible at the nth hour. We had a wonderful stay with the entire hotel staff being very friendly and caring. Right from the service desk to housekeeping we had a great experience with each and every staff members,Sniggu,Wedding,220426
25-04-2022,5,The ITC Maratha is located very close to the Mumbai airport and is a destination for pure luxurious stay. Rooms are spacious with pleasing ambiance and upscale amenities. WiFi is fast and covers entire property. ,Praveen M,True to its name.,220425
23-04-2022,5,I have stayed in this Hotel twice in the last one year and undoubtedly this is going to be my first choice when traveling to Mumbai. Everything is just superb about this hotel. Food service cleanliness hospitality location room sizes everything. The Swimming pool is clean and beautiful. The check in/out process is somewhat slow/sluggish and needs improvement. Overall a good job being done by all in the Team. Kudos !,ARVINDAhmedabad,A Gem,220423
19-04-2022,5,We had an amazing stay in ITC Maratha. To be frank in the last 4 years i have stayed in couple of ITC properties. ITC Maratha surely bags the top spot for me.,CharanjitJassar,Mesmerizing stay Experience  Extremely helpful staff,220419
17-04-2022,5,We stayed  in ITC Maratha  Mumbai for a couple of days.  We had a peaceful stay and loved the food served. Service was prompt and anything we requested was promptly made available.  Thank you for a wonderful experience.,Sridp,Stay in ITC Maratha,220417
15-04-2022,5,Great hospitality. It is truly a luxury property ,Rushikesh1100,Amazing stay,220415
14-04-2022,5,We had a lunch buffet party for 32 people. The spread was excellent. The food quality was obviously 5* level. The chief chef mr Nikhil personally met us to see if any special requirements. A few amongst us were Jain and their food was prepared in a separate kitchen. The chaat counter chef (mr Sitaram?) was very enthusiastic to feed us well.,Damanig,Excellent lunch buffet and service,220414
14-04-2022,5,Had a great stay at ITC Maratha absolutely loved dinning at Peshawari restaurant if you are looking for authentic afgani cusine this place is for you. Loved the pool ambience enjoyed swimming after long. Lobby could be better though. Upper crust lounge is very nice and has a calming effect as it gives you a wonderful view of the entire hotel.,shelovesclassy,Beautiful hotel,220414
14-04-2022,5,On 9th of April '22 had sent Gift Cake and Bouquet from the hotel for the Belated Celebration of my Friends Birthday. ,IshanGanguly,Most Mesmerizing Service from ITC Maratha !!!,220414
13-04-2022,5,Very nice and sophisticated hotel. Luxury meeting rooms and dining rooms.,jamesequity,Great place for a seminar,220413
12-04-2022,5,Great location really pleasant and clean rooms. We had a room with a pool view which was quite a treat. We stayed here just for a night and were greeted with best customer service especially Druvi from Guest relations was very generous helpful with the incredible food recommendations. Will definitely come at ITC when we are in Mumbai. It is totally worth it.,Nehaasingh29,Excellent stay,220412
11-04-2022,5,A memorable staycation at ITC Maratha courtesy their wonderful team.,NavinAggie,A wonderful staycation thanks to ITC Maratha's team,220411
09-04-2022,5,I am indeed happy with my stay at the restaurant. Ms.Pooja at guest services took special care to make the stay memorable as it was for a birthday occasion that we had booked our room. She will be my person if ever I have to plan an occasion at ITC. We have always had a wonderful experience at our stay and visits here. ,484nikithat,Extremely happy with my visit and service,220409
09-04-2022,5,Usually not a person to write reviews but couldn't resist writing one for my stay at ITC Maratha..when we checked in Saurabh at the front office checked us in. He was so courteous and explained everything in detail along with being patient with our crying kids. The room was immaculately clean and had all comforts one needs for a holiday. We ordered room service and the food was excellent - they made rice and lentils for our kids with no spice on special request. I want to mention 2 people at the breakfast as well who really went way and beyond to help me imran chaudhry and Angad yadav. I only stayed for one night but I wish it was a longer stay. On our way out I met the front office manager Aadhaar Sharma who came and checked if our stay was comfortable. He was so polite and welcoming that I can't wait to go back and can't stop raving about the hospitality.,Namrata2022,ITC - Maratha,220409
09-04-2022,5,Thanks to Aadhar Sushant Hitesh Kapil Maxim Concierge Bell Desk Valets & Doormen for a Wonderful Hospitality and Happiness Experience. ,Ashwin V,ITC Maratha Mumbai - a Luxury Collection Hotel,220409
07-04-2022,3,Stayed here for 2 nights and was rather disappointed for a 5 star hotel.,queenspr,Not a 5 star experiance,220407
06-04-2022,5,My overall stay experience is excellent.  Mr Rohit had selected a very elegant and comfortable room for me. He also made my check-in and check-out experience very comfortable. Chef Parvin Patel ji had given personal attention during my breakfast. Ms Anjali always arrange table for me as early as possible for breakfast.  Ms Sakshi and Mr Sawant had served food very quickly. Shafan Adrian and Ajay ji. P they take care of my language handling and security checking whenever I had returned  back to hotel and going outside the hotel. ,aggarwald24,Room are beautiful. Breakfast & food served in the restaurant were very delicious. Hotel is at walking distance from T2 Mumbai ,220406
05-04-2022,5,I am glad to write this review about this beautiful property this place charmed me with it's comfort and luxury The staff of this property are courteous HelpfulAccmodative in every way and always ready to solve all your queries specially Thanks to trip advisor for giving me this platform to express my view and Mr Aadhar fromFOM and Taslim from Guest Relation Team of this property. ,guruchaya,Wonderful stay,220405
05-04-2022,4,In general a good hotel. Nothing a lot around but rooms are well equipped large and above average. Staff is experienced and professional. Food and beverage wise you have a lot of options. Bur room service is not cheap even in India standards. I may recommend.,Berat B,One of he good around airport,220405
