date,rating,review,reviewer,title,ymd
11-04-2021,5,I visited this place for the first time and it was an amazing experience. I am really overwhelmed by the beauty size and décor of this marvelous property. All the staff at this hotel and also at the restaurant are very polite professional and knowledgeable. Their treatment at every stage is very good and very appreciable. Special thanks to Mr. Sushant Rane who helped incredibly. People at the gate are also doing a great job. The level of precautions and sanitization practices is very comforting and inspires safety. Will be a pleasure to return and recommend. ,RoshniAS,Wonderful stay and great hospitality,210411
11-04-2021,4,I stayed at ITC Maratha for business visit and the hotel property is beautiful. The service is good and all covid protocols were being followed properly. The breakfast has a good range of items and the food is tasty. Would recommend a stay at this hotel. ,ShikshaC,Pleasant stay…,210411
10-04-2021,5,I again stayed here at ITC maratha and was upgraded to ITC one all thanks to Archit the duty manager and he made sure he took care of me n my family . I loved the hospitality and warmth from delzine and bell desk Sanket ,rishf2017,Locked down gettaway 2021april,210410
01-04-2021,5,Well I would say that the staff of ITC maratha truly knows the meaning of this and are highly professional in what they are doing.. They are maintaining the best safety and hygiene standards throughout the property. Times are hard for everyone due to covid situation but the staff is giving its best efforts to make us feel safe.,Pahaditraveller16,Atithi Devo Bhavah!,210401
26-03-2021,5,ITC Maratha is truly a splendid property with great staff members who are always ready to assist. My visit was short and  Delzine was excellent and took care of all my needs. Keep up the good work and I shall certainly recommend ITC Maratha ,thewanderer977,Great experience,210326
19-03-2021,5,I had the absolute pleasure of staying at the iconic ITC Maratha.The rooms were extremely comfortable and very well appointed. The room cleanliness was Immaculate!!!.All thanks to the amazing Housekeeping squad working day and night to keep the rooms absolutely clean and safe to use in these unprecedented times. I would also like to thank Ms.Aishwarya Bagalkar (Hk Manager) for treating us like her family. She was extremely polite courteous and thoroughly instrumental in ensuring that we had a memorable stay.Keep up the amazing hospitality guys.I will recommend all my friends to stay at ITC Maratha.,448sangitap,Spectacular efforts by Young Housekeeper Ms. Aishwarya!!!Absolutely Loved the stay!!,210319
19-03-2021,5,We had gone for a staycation for anniversary to ITC at Sahar and enjoyed our experience. The highlight was our couples spa with two massages and shared jacuzzi experience.It was pure indulgence and the staff made us feel even more pampered. The food was on point too! So if your looking for intimate and luxurious experience I would highly reccomend the hotel!,Chriselle B,Highly reccomend,210319
18-03-2021,2,Live spider nails and leftover food in the bin!! ,Garrettrahman,Live spider nails and leftover food in the bin!! ,210318
15-03-2021,5,I had stayed in this hotel many times in the last few months. Though it is a luxury 5star hotel room tariff is relatively less. ,NMPRASAD,Excellent luxury hotel near international airport,210315
13-03-2021,5,Just visited the hotel for a business trip. The hotel is really close to the airport and convenient. They also have alot of good restaurants like the peshawari and dumpukht and if you wanna have some dessert then the famous fabelle ITC ,Vishalkillekar123,Good hotel for a visit,210313
12-03-2021,5,Had visited the property for my anniversary. Person who took the check in Mr. Sushant was very polite and helpful. I had booked for a executive room however the upkeep of the room was not as per the standards. Request you to not sell these rooms as they make a bad impression. Mr. Uday from housekeeping was very kind to upgrade us to ITC one. This room was not only spacious but was vibrant and colourful. All necessary amenities were placed inside the room. A small cake was sent on the compliments of the hotel. Ms. Sayli was very helpful with my request. The staff is well mannered and polite. Food was delicious and was served  in abundance. Will visit again and recommend to friends and family.,Priyankapinku,Lovely stay.. beautiful property,210312
08-03-2021,5,I had hosted a mid-sized marriage event for my son and had expected the hotel to deliver an excellent event. Despite all constraints of COVID the hotel and its staff delivered to us a very tailor made event with an amazing eye for detail some great food and service overall a great event. All along all the guests felt most welcome at the hotel and returned with some great memories. ,KiranShing,Exceeded expectations raised the bar,210308
05-03-2021,5,Had a wonderful time at the hotel ! The team is fabulous and take very good care of all guests. I have stayed here multiple Times . Rashpal has been very kind and helpful . She has assisted with checkin  billing and membership queries . Also upgraded me to a beautiful tower room when I visited with family . I always prefer to stay at ITC hotels because of  the caring treatment we have got . The food is amazing and services are top notch . Will recommend all to stay at ITC hotels.,SukantDole2021,Great stay!,210305
02-03-2021,5,Amazing hospitality! Especially the employees. They have made my stay a memorable one.,950simrand,A memorable one,210302
01-03-2021,5,Wedding function at ITC ,abhiprabhat619,Wedding function at ITC ,210301
28-02-2021,5,Stayed over at ITC Maratha recently on a solo trip and thoroughly loved the ambience and comfort. All Covid-19 precautions were adhered to and exceptionally handled by the Hotel team. ,Arvind-Mahesh,A Hotel at its Finest!,210228
26-02-2021,5,one of the finest luxury hotel I have visited till now..architecture of the Maratha dynasty with fine interiors and great hospitality..I was warmly welcomed the executive shayali..she made my stay very pleasant with a warm welcome and was there everyday to assist me. she even  arranged a cake for me on my anniversary and also allowed me a good spacious room..food at peshawari its just awesome..haven't had such a great north Indian cuisine till date..I was surprised that the hotel has taken the initiative to use minimum plastic..its a very good initiative and I wish them all the success towards reaching this goal..,surfer008,Luxury at its best,210226
25-02-2021,5,ITC maratha is at a walking distance from the airport or 5 min from cab. ,Rohit_G17,Great property and rooms,210225
25-02-2021,5,Me and my wife stayed here for a night on 17 Feb. Although a short stay it was an amazing experience overall. ,Ankstraveller,Luxury feels at ITC,210225
22-02-2021,5,Thank you ITC supporting us in making Aneesh/Kshiti wedding very special.,Jaskinder S,Wedding,210222
21-02-2021,5,A perfect gift for best friend wedding. So we were looking for a appeasing first night stay for the newlyweds. We came across a lot of options but glad we selected ITC because it was on point for everything location welcoming staff hospitality service room food & decor. A special mention to Ketan for being incredibly helpful & there for every need of mine. Thank you again ITC for going just that little step extra for the guests! Definitely recommending it to my close ones.,Madhav_Gandhi,Best experience,210221
21-02-2021,1,Stayed from the 19-21 feb  through an offer on MMT . The room was good  but the Ac kept making a noise . This was an all meal inclusive plan the buffet was super disappointing quality and taste .,bakshipranav,Staycation- the joke of an offer ,210221
20-02-2021,5,Gurpreet,jaikishinbl,Wedding,210220
20-02-2021,3,I stayed at the hotel for 4 days. The hotel is well kept and when you enter it does gives you a feeling of luxury and raise your expectations.,Foodieeglobetrotter,Average experience,210220
14-02-2021,5,I was looking for a safe-stay experience during Covid and ITC Maratha was a perfect choice... they follow all protocols nicely!  The staff is courteous and their delivery timelines for any request are adhered to. They are quite transparent about what is possible and what isn't and that's a good way to keep communication effective and efficient.,Ridhi R,My perfect getaway,210214
11-02-2021,5,Exceeds Expectations,amrutadadhe,Exceeds Expectations,210211
11-02-2021,5,Beyond expectations,Hoteliersincebirth,Beyond expectations,210211
10-02-2021,5,Moved to ITC Maratha few months back and it's always been a comfortable stay. Chandranath the manager has always personally come and met me and recognises me every time for my Marriott Platinum status. ,bharatnvyas,Excellent Hospitality,210210
10-02-2021,4,I had a great experience with ITC. The room was wonderful clean and perfect for a family weekend. The amenities were great and the staff was incredibly helpful especially Mr. Sumit who went over and beyond to help make our stay enjoyable. Considering the current situation all safety precautions were taken so it was a relaxed outing for us.,KhushbuM02,Excellent Hospitality and comfortable stay,210210
10-02-2021,5,It was a splendid stay at ITC Maratha.All the staffs from all the departments was very cooperative and humble towards their guest especially Sayali Ingale has very friendly and helpful behaviour towards all guest.They all were on toes to serve their guest for phenomenal experience during their stay at ITC Maratha.,MANVENDRA94,Had Pleasant stay at ITC Maratha Mumbai.,210210
09-02-2021,5,Excellent is the only word to describe my experience. The duty manager Sumit was one of the most amiable person I've met and he certainly made sure that my stay was as comfortable as possible. Would love to go back once again for sure. :),BManas,One day stay,210209
09-02-2021,5,Enjoyed everything about this property from the food till the comfort in the room. The We Assure program during covid is a good initiative of sanitization in the hotelalso offers delivery services for food so that it can be enjoyed at the comfort of our homes there is nothing that ITC has not thought about.,mendes19,A Good Experience,210209
08-02-2021,5,My experience at the ITC Maratha was nothing less than just fabulous and memorable. The property is beautiful and the staff are very friendly whose  willingness to understand and resolve their guests queries is just priceless. In particular I would like to specially mention the always helpful Mahima I have never come across anyone carrying a smile all day like she did whenever I met her and showing the same level of hospitality always. Staff like her are not just assets for the hotel but also the industry. Thank you again to everyone back at the ITC Maratha.,hamzah741,Absolutely Fabulous ,210208
08-02-2021,5,Staff is very polite and humble. All requests are taken promptly and closed on time. Peshwa Pavilion has a good breakfast variety to offer. ,Kevin_samuel1995,A Second Home,210208
08-02-2021,5,Had visited ITC Maratha last monthwithout a doubt the safest hotel to visit during Covid. Precautions were taken for seemingly minute details which otherwise go unnoticed. Would highly recommend for someone who is bit apprehensive to visit hotels nowadays like myself. Special thanks to Sumit for taking utmost care of us.Cheers,ReginaPhalenge,Thankyou ITC Maratha,210208
08-02-2021,5,So it was our anniversary and during these testing times we thought we could pick a safe choice with ITC Maratha. It was very very kind of  Mr. Chandranth  Duty Manager to ensure we were pampered and felt at home. I think it was my luckiest day to have met him. He ensured my family and I were comfortable. He also upgraded the room to a super luxurious one and made us feel ultra special on our special day. We were super thrilled. He ensured during our meals we were comfortable and seen upon. He also surprised us with a lovely cake.  It was because of his lovely gestures and warm hospitality we felt so so special. Big thanks to him and ITC Maratha for making our stay so memorable and luxurious and pampered one. ,Dimpledugar,A luxurious pampered memorable stay,210208
06-02-2021,5,We recently booked a hotel room for our parents to bring in their 50th Golden Anniversary. ,LEVEL6_FOODCRITIC,One of the best 5-Star Hotels in Bombay.,210206
04-02-2021,5,It was such an amazing stay with ITC ,DCECEVENTS,Amazing hospitality with Awesome food with courteous behaviour💖,210204
28-01-2021,5,Beautiful property! Extremely close to the airport. Great people greeting everyone with a namaste and a smile. Pooja & Delzine graciously accommodated all my requests. The safety measures make you feel safe.  Keep up the good work team!,WajidShaikh111,Great hosts,210128
28-01-2021,4,The thing that impressed me the most was the health & safety protocols in place. There was thermal screening checks & sanitization procedures upon entry and social distancing was maintained at all times. When it came to dining the buffet service was managed by staff behind the counter thereby containing the spread of any germs. All cutlery came sterlized and packaged. ,Rochelle R,Good health & safety measures in Covid times,210128
27-01-2021,5,Thank you Team ITC for making my Wifes Birthday a memorable experience. A special thanks to Pooja Tripathi for the warm welcome who made sure the check in and check out process was smooth and quick as we had a baby with us. Aman from front desk made the room available quickly so we didnt have to wait long. Would also like to thank Eknath and Kishor for the quick room service. Thank you Mrs Laxmi Chakravarty for taking the room service request. Also a special thank you to Mr Uday for making the birthday arrangements as requested. The celebration was for my Wife but more than her its my kid who enjoyed the stay... Sorry if I missed a few but once again thank you for your hospitality...,RvMoksh,A Memorable Experience,210127
26-01-2021,5,Great place  helpful staff,shraddha k,Great place  helpful staff,210126
25-01-2021,5,We stayed for 2 nights as post pandemic we were really exhausted and needed a stay which is absolutely superlative hygiene standards. iTC Maratha proved  to be THE perfect staycation place. A special mention of Mr. Vishal at Peshwa Pavilion for his prompt service very helpful attitude and polite demeanour. Kudos to Team ITC. We look forward to coming again !,saumitrabt,Wonderful experience at ITC Maratha,210125
25-01-2021,5,Checked in here after a busy week ITC Maratha was the perfect 1-night break for me. On check-in even though it was very short notice and the hotel was fully booked the hotel staff organised a room of my preference. The food was great and the staff was extremely warm. I think it was Pradeep who helped me with my luggage he was super helpful.,kritvirana,Beautiful room and great food,210125
24-01-2021,5,A solo travel requires alot of comforting according to me and without a doubt I remember a few people who ensured there was no lack of comfort for me during my trip Ms. Sushmita and Mr. Chandranath at the time of check in were very subtle quick and warm. Ms. Sushmita was super helpful with every request I had and her knowledge of the city and sites to look at with places to chill was absolutely helpful. Kudos for your efforts and dedication Ms. Thanks to the whole team of the hotel you guys are doing a fantastic job... Keep it up... ,Aman  D,Thanks and Kudos,210124
24-01-2021,5,Ive been coming quite often to ITC but the experience this time has been very delightful and the full credit goes to Raunaq Ramwani from the front desk office who has been really cordial and accommodating. He has handled my stay very professionally. Hes one of the best representative at ITC in my opinion. Thank you!!,rthpr,One of the best in Mumbai!!,210124
21-01-2021,5,Came with my friends with zero expectations as it was the covid time. I was pleasantly surprised by the way the entire team welcomed us. ,Nama76854,Lovely staff and rooms,210121
19-01-2021,5,I stayed at ITC Maratha for first 2 weeks of Jan'21. The hotel is beautifully designed and well maintained. In times of COV19 substantial precautions have been put in place to ensure safe stay.,Prathamesh S,Excellent place to stay with courteous staff to assist !!,210119
16-01-2021,5,This was the first time stayed with  ITC. The hospitality was great.  Check in was smooth by Mr Shantanu The COVID-19 Precautions are taken at this property We had taken two room and both of them were perfect. The Rooms were spacious and comfortable with well stocked amenities. Breakfast Buffet was Good not too many varieties might be due to COVID-19 pandemic but it was sufficient The chef was really courteous and the FNB team.  The guest service team was great and prompt. The only negative was the air conditioning Would surely visit again in the future.,SAH321,Great Hospitality,210116
10-01-2021,5,Leisure Trip,rakeshd506,Leisure Trip,210110
08-01-2021,4,The food was delicious,ShoaibM147,Lunch buffet,210108
03-01-2021,5,The hotel has a royal feeling and the way meet n greet was done was superbly perfect,329preetk,Awesome service ,210103
01-01-2021,4,Good stay but not so good food,meghna2701,Good stay but not so good food,210101
01-01-2021,5,We stayed there for 3 nights and the stay was very pleasant. The property is very well maintained and they are following all social distancing norms. ,akshay5656,Great Hospitality,210101
29-12-2020,5,  The hotel stay was very pleasant and comfortable. The staff was very polite and helpfull spclly (sayali from FO & imtyaaz and vishal from F&B) they were quick with there services,AsIfS469,Services,201229
27-12-2020,5,One of my best stays with the family.,rishtejs,Excellent food and services,201227
27-12-2020,5,We had 2 rooms at ITC Maratha and we upgrade during our stay.  The online Checkin process was very new for us but the staff explained its need in these times and we really appreciate the actions taken by ITC hotels for guest and staff safety. We would like like to thank Rashpal from the front desk - we informed her that we were coming for Xmas outing with our children and also celebrating husbands bday . She upgraded us to a beautiful room and also arranged a cake for us. The housekeeping staff was very attentive to all requirements and always smiling and delivering services . We had a great time at the hotel and will visit again !,Rinku R,Lovely stay,201227
27-12-2020,5,One of my best stays with the family.,Sameerarora2020,Lasting memories,201227
25-12-2020,4,It was a good stay! Ms. Shivani Gupta was particularly very helpful accommodating and provided very prompt service. Very happy with her service and overall hospitality. Enjoyed and had a great time. The restaurant Kebabs and Kurries is good and the black dal there is awesome. Had a wonderful time and everyone made sure we got good service. Proper covid norms were followed and hygiene was maintained throughout the property. ,Prernan24,Great service by Shivani Gupta,201225
21-12-2020,5,Excellent !! ,Rumanaachwa,Excellent !! ,201221
21-12-2020,5,Stayed for 14 days at ITC Maratha and every day the staff took utmost care of all my needs. The staff were polite and friendly.,Zaainu,Excellent Stay,201221
18-12-2020,2,I stayed for 2 nights. All though this is a very nice 5* property with all amenities needed they lack to tick the box when it comes to comfortable sleep: my room was above the atrium and so I got the noise and music from there until late night. On top of that I got noise from adjacent rooms as well. Not what I would expect from such a property. Would not recommend to stay. ,GillesR948,Noisy!,201218
07-12-2020,5,Delzina & Team ITC Maratha,SiddhantM85,Delzina & Team ITC Maratha,201207
01-12-2020,5,We celebrated our 1st year anniversary at itc and it was totally worth the experience . Excellent hospitality by the entire team .,Bhatiapooja02,Excellent!!!!,201201
01-12-2020,4,Covid has restricted travel to other locations so staycations have become the norm right now. ,jayeshkeha,Luxury Redefined! ,201201
28-11-2020,5,The hotel stay was very pleasant and comfortable. The staff was very polite and helpful specially Mr. Dhan. He is very good person. He met me every day during my 14 days stay and make me feel comfortable.I would definitely stay there again and recommend others also. The food was very good quality and quantity also more than sufficient. My sincere thanks to each and every staff of the hotel.,AbhijitB1234,Pleasant stay in ITC Maratha,201128
22-11-2020,5,The WeAssure program by ITC gives a sense of comfort and safety when compare to other vicinity hotels which do not have such programmes in ones mind of everything being sanitized at the hotel. All the way from lobby to restaurants and all the other areas there is adequate measures taken to ensure safety for guest would like to thank the team for making such amazing food.,Rishabhramwani,Experience,201122
19-11-2020,5,I would like to thank a concierge member Vijay for his excellent customer service and customer care. Whatever your needs are Vijay will take care of it for you.,Paola B,Wonderful,201119
17-11-2020,5,Celebrated my mothers 68th Birthday at this gorgeous property. Absolutely delighted with the way everything was managed. This was the first time we got out post Covid lockdowns. Sanitisation measures taken were beyond satisfaction. Felt safe throughout the stay and celebration. I would personally like to thank Ajay and Pramod from Peshwa Pavilion Vijay from baggage assistance and Chef Nikhil Merchant for raising the bar of ITC hospitality. ,jjsaluja,Birthday Celebration,201117
15-11-2020,5,Best stay I ever had !,bhekuli,Best stay I ever had !,201115
10-11-2020,5,I had a wonderful staycation with my fiancée at ITC Maratha. Fahad Korlekar from ITC Grand Central helped me with the booking process. And Saurabh from ITC Maratha made my stay very comfortable. The staff was very helpful and generous. The property holds an exquisite and classy feeling. They are following all the precautionary measure to ensure the safety of guests. The food was amazing. And breakfast had a variety of options available. I would definitely recommend this property to my friends and family.,Iamsabirkhan,A perfect staycation ♥️,201110
09-11-2020,5,It was such a wonderful experience every time Im at this hotel. The comfort of the room reminds one of home. Also the warmth and sincerity of the staff always makes me look forward to the stay. Particularly mention of one staff - Vijay he exudes such friendliness and remember all his guests. Vijay also provides great service and makes one feel so welcome every time. Kudos to ITC Maratha. ,Kgpj,Wonderful stay,201109
08-11-2020,5,Where do I start I'm pleased with the food accommodation and the staff. The hospitality of ITC Maratha has been nothing short of 'Service Excellence'. I've been staying here since the last seven days and it's going great. The overall services and facilities are simple phenomenal. Compliments to the housekeeping services of Mr. Kush Kumar :) ,Vidisha_Pandey,Great Stay,201108
08-11-2020,5,Stayed for one week from 1st to 8th of November. It was wonderful experience especially the room service staff one Mr dhan was polite prompt and professional approach. Service was excellent. Wonderful experience from receptionbell deck and even the security.,680jojor,Jojo Veliparambil Raphy,201108
02-11-2020,5,Dear sir  ,CarenT1,Compliments of service to Vijay Pujari,201102
29-10-2020,3,We came from delhi to mumbai for some work and stayed here and to be honest it was not as good as our previous stay here. But we understand that because of lack of staff its hard. One of the staff member Dhan(ITC Maratha) was very cooperative and helpful. We personally liked his service. And we also appreciate all the staff member's effort. ,jahnulahon99,It was not the best but we understand,201029
26-10-2020,5,Had recently been to ITC Maratha and im highly pleased with their hospitality. They made sure that all sorts of precautions are being taken to cope up with the current situation. Excellent rooms with great service. We had opted for a brunch which had a huge spread from different cuisines along with alcoholic/non-alcoholic beverages. The staff was highly co-operative and well mannered. MR. Edwin was very polite and made sure that we enjoy our little weekend getaway. :) ,shreyamanikandan,ITC Maratha ,201026
24-10-2020,5,Stayed here for 3 weeks now in-spite of pandemic situation  limited staffs and many restriction by government Yet the pleasure of staying and generous services showed by entire ITC Maratha team is awesome. No words to complaint  nor a chance given to point out.  ,Shree0810,ITC as always at its BEST,201024
23-10-2020,5,I stayed here for 14 days..It was the nicest among all the luxury hotels I have ever been to..The hospitality they provided is incomparable..I had stayed in luxury hotels arround the globe but ITC is the best. My friend recommended me hereand he gave me the contact details of Dhan from hospitality department. I will always remember Dhan's service..He never let me feel that I'm outside home..Such a lovely person..I will recommend all to chose ITC over all other available international hotel chains like Marriott Westin..,udbodhan,Greatest among all,201023
23-10-2020,4,Restaurant Review of Peshawari - First Restaurant visit (post Covid) on 18th October 2020.,Funnytraveller04,Restaurant Review of Peshawari - First Restaurant visit (post Covid) on 18th October 2020.,201023
